{
  "schemaVersion": 1,
  "id": "diag-05-000pa",
  "version": 1,
  "title": "Король без укрытия",
  "instruction": "Поставьте мат в один ход.",
  "fen": "5rk1/5pp1/7p/3p4/1KpPn3/4PPP1/1P2N1P1/r4R1R b - - 0 24",
  "side": "b",
  "category": "Мат в один ход",
  "difficulty": "Средняя",
  "solutions": [["f8b8"]],
  "hint": "Проверьте шахи ладьёй по восьмой горизонтали.",
  "explanation": "Rb8# ставит короля b4 под шах по линии b. Ладья a1 контролирует линию a, конь e4 отнимает c5 и c3, а пешки и собственные фигуры закрывают остальные поля. Королю некуда уйти.",
  "source": "https://lichess.org/training/000pA · Lichess database, CC0 · rating at import 1162",
  "verification": {
    "engine": "Stockfish 19",
    "depth": 20,
    "bestMoves": ["f8b8"],
    "score": "#+1"
  }
}
